{
  "date": "2026-09-29",
  "status": "green",
  "summary": "GitHub push event processed for jobfynder-admin/jobFynder-FE-vite on branch dev.",
  "repositories": [
    "jobfynder-admin/jobFynder-FE-vite"
  ],
  "completed": [
    "Source: GitHub webhook",
    "Repository: jobfynder-admin/jobFynder-FE-vite",
    "Branch: dev",
    "Head SHA: 102bac5",
    "Commit count: 1",
    "Triggered by: jobfynder-admin",
    "Commits:",
    "102bac5 refactor(onboarding): simplify onboarding role selection and update signup flow \u2014 Nishant Arora",
    "Changed files:",
    "modified: src/components/components/auth/onboarding/OnboardingRoleForm.tsx",
    "modified: src/pages/auth/onboarding.tsx",
    "modified: src/services/authService.ts",
    "modified: src/utils/onboardingOAuthContext.ts",
    "modified: src/utils/onboardingTransform.ts"
  ],
  "decisions": [
    {
      "id": "ADR-EMI-002",
      "title": "Engineering Memory accepts GitHub webhook input",
      "status": "accepted",
      "summary": "Hermes can generate engineering memory from GitHub webhook repository, branch, commit, author, and changed-file context."
    }
  ],
  "incidents": [],
  "lessons_learned": [
    "Repo-aware engineering memory is more useful than generic repository scanning.",
    "Webhook payloads provide reliable commit, author, branch, and changed-file context."
  ],
  "open_items": [
    "Improve event archive to store full webhook payload.",
    "Add failure alerting for memory automation.",
    "Add deduplication guard for repeated memory commits."
  ],
  "tomorrow_objective": "Use repo-aware engineering memory as the default source for GitHub-triggered automation."
}