{
  "date": "2026-10-14",
  "status": "green",
  "summary": "GitHub push event processed for jobfynder-admin/jobFynder-BE-nestJS on branch main.",
  "repositories": [
    "jobfynder-admin/jobFynder-BE-nestJS"
  ],
  "completed": [
    "Source: GitHub webhook",
    "Repository: jobfynder-admin/jobFynder-BE-nestJS",
    "Branch: main",
    "Head SHA: 000e696",
    "Commit count: 2",
    "Triggered by: atult120",
    "Commits:",
    "821dc67 feat(open-positions): proxy open positions to job postings \u2014 atultiwari",
    "000e696 Merge pull request #33 from jobfynder-admin/feat/open-positions-jobs-facade \u2014 Atul Tiwari",
    "Changed files:",
    "added: prisma/migrations/20261014210000_link_open_roles_to_job_postings/migration.sql",
    "added: src/profile/employer-ops/employer-ops.service.spec.ts",
    "modified: prisma/schema.prisma",
    "modified: src/profile/employer-ops/dto/employer-ops.dto.ts",
    "modified: src/profile/employer-ops/employer-ops.service.ts",
    "modified: src/profile/profile.module.ts"
  ],
  "decisions": [
    {
      "id": "ADR-EMI-002",
      "title": "Engineering Memory accepts GitHub webhook input",
      "status": "accepted",
      "summary": "Hermes can generate engineering memory from GitHub webhook repository, branch, commit, author, and changed-file context."
    }
  ],
  "incidents": [],
  "lessons_learned": [
    "Repo-aware engineering memory is more useful than generic repository scanning.",
    "Webhook payloads provide reliable commit, author, branch, and changed-file context."
  ],
  "open_items": [
    "Improve event archive to store full webhook payload.",
    "Add failure alerting for memory automation.",
    "Add deduplication guard for repeated memory commits."
  ],
  "tomorrow_objective": "Use repo-aware engineering memory as the default source for GitHub-triggered automation."
}