{
  "date": "2026-09-19",
  "status": "green",
  "summary": "GitHub push event processed for jobfynder-admin/jobFynder-BE-nestJS on branch codex/bsr-extension-private-job-capture.",
  "repositories": [
    "jobfynder-admin/jobFynder-BE-nestJS"
  ],
  "completed": [
    "Source: GitHub webhook",
    "Repository: jobfynder-admin/jobFynder-BE-nestJS",
    "Branch: codex/bsr-extension-private-job-capture",
    "Head SHA: 4656346",
    "Commit count: 5",
    "Triggered by: jobfynder-admin",
    "Commits:",
    "a28c9a7 feat(extension): isolate private tracked requirements \u2014 Jobfynder",
    "47ae586 feat(extension): add multi-role v3 bootstrap \u2014 Jobfynder",
    "699dfa5 feat(extension): add governed role capture paths \u2014 Jobfynder",
    "25c8cb5 feat(extension): add role-aware match intelligence \u2014 Jobfynder",
    "4656346 feat(extension): govern ATS autofill and confirmed applications \u2014 Jobfynder",
    "Changed files:",
    "added: prisma/migrations/20260918190000_add_private_tracked_requirements/migration.sql",
    "added: prisma/migrations/20260918200000_add_extension_audit_events/migration.sql",
    "added: prisma/migrations/20260918210000_add_tracked_applications/migration.sql",
    "added: src/extension/extension-autofill.service.spec.ts",
    "added: src/extension/extension-autofill.service.ts",
    "added: src/extension/extension-v3.controller.ts",
    "added: src/extension/extension-v3.service.spec.ts",
    "added: src/extension/extension-v3.service.ts",
    "added: src/jobs/jobs.controller.authorization.spec.ts",
    "modified: prisma/schema.prisma",
    "modified: src/bench/privacy-filter.service.ts",
    "modified: src/bench/submission.service.ts",
    "modified: src/extension/extension-skill-intelligence.controller.ts",
    "modified: src/extension/extension-skill-intelligence.service.ts",
    "modified: src/extension/extension-v3.controller.ts",
    "modified: src/extension/extension-v3.service.spec.ts",
    "modified: src/extension/extension-v3.service.ts",
    "modified: src/extension/extension.controller.ts",
    "modified: src/extension/extension.module.ts",
    "modified: src/extension/extension.service.spec.ts",
    "modified: src/extension/extension.service.ts",
    "modified: src/jobs/jobs.controller.ts",
    "modified: src/profile/completeness/completeness-config.ts"
  ],
  "decisions": [
    {
      "id": "ADR-EMI-002",
      "title": "Engineering Memory accepts GitHub webhook input",
      "status": "accepted",
      "summary": "Hermes can generate engineering memory from GitHub webhook repository, branch, commit, author, and changed-file context."
    }
  ],
  "incidents": [],
  "lessons_learned": [
    "Repo-aware engineering memory is more useful than generic repository scanning.",
    "Webhook payloads provide reliable commit, author, branch, and changed-file context."
  ],
  "open_items": [
    "Improve event archive to store full webhook payload.",
    "Add failure alerting for memory automation.",
    "Add deduplication guard for repeated memory commits."
  ],
  "tomorrow_objective": "Use repo-aware engineering memory as the default source for GitHub-triggered automation."
}