{
  "date": "2026-08-14",
  "status": "green",
  "summary": "GitHub push event processed for jobfynder-admin/jobFynder-FE-vite on branch dev.",
  "repositories": [
    "jobfynder-admin/jobFynder-FE-vite"
  ],
  "completed": [
    "Source: GitHub webhook",
    "Repository: jobfynder-admin/jobFynder-FE-vite",
    "Branch: dev",
    "Head SHA: 510b147",
    "Commit count: 2",
    "Triggered by: jobfynder-admin",
    "Commits:",
    "6b6feb1 Wire Messenger conversation archive \u2014 Pavan",
    "510b147 Merge branch 'dev' of https://github.com/jobfynder-admin/jobFynder-FE-vite into dev \u2014 Pavan",
    "Changed files:",
    "added: .github/workflows/chatwoot-integration-check.yml",
    "modified: src/components/ChatwootSupportWidget.tsx",
    "modified: src/components/messenger/ConversationSidebar.jsx",
    "modified: src/features/messenger/messengerApi.ts",
    "modified: src/lib/messengerApi.ts",
    "modified: src/services/chatwoot-support.ts",
    "modified: src/store/useAuthStore.ts"
  ],
  "decisions": [
    {
      "id": "ADR-EMI-002",
      "title": "Engineering Memory accepts GitHub webhook input",
      "status": "accepted",
      "summary": "Hermes can generate engineering memory from GitHub webhook repository, branch, commit, author, and changed-file context."
    }
  ],
  "incidents": [],
  "lessons_learned": [
    "Repo-aware engineering memory is more useful than generic repository scanning.",
    "Webhook payloads provide reliable commit, author, branch, and changed-file context."
  ],
  "open_items": [
    "Improve event archive to store full webhook payload.",
    "Add failure alerting for memory automation.",
    "Add deduplication guard for repeated memory commits."
  ],
  "tomorrow_objective": "Use repo-aware engineering memory as the default source for GitHub-triggered automation."
}