{
  "date": "2026-09-08",
  "status": "green",
  "summary": "GitHub push event processed for jobfynder/hermes on branch fix/hermes-850-warm-ner-pipeline-at-startup.",
  "repositories": [
    "jobfynder/hermes"
  ],
  "completed": [
    "Source: GitHub webhook",
    "Repository: jobfynder/hermes",
    "Branch: fix/hermes-850-warm-ner-pipeline-at-startup",
    "Head SHA: cf3f841",
    "Commit count: 1",
    "Triggered by: jobfynder",
    "Commits:",
    "cf3f841 fix(startup): load the NER model at app startup, not on the first request that needs it \u2014 Jobfynder",
    "Changed files:",
    "modified: app/email_parsing/signature.py",
    "modified: app/main.py",
    "modified: scripts/hermes-850-email-signature-check.py"
  ],
  "decisions": [
    {
      "id": "ADR-EMI-002",
      "title": "Engineering Memory accepts GitHub webhook input",
      "status": "accepted",
      "summary": "Hermes can generate engineering memory from GitHub webhook repository, branch, commit, author, and changed-file context."
    }
  ],
  "incidents": [],
  "lessons_learned": [
    "Repo-aware engineering memory is more useful than generic repository scanning.",
    "Webhook payloads provide reliable commit, author, branch, and changed-file context."
  ],
  "open_items": [
    "Improve event archive to store full webhook payload.",
    "Add failure alerting for memory automation.",
    "Add deduplication guard for repeated memory commits."
  ],
  "tomorrow_objective": "Use repo-aware engineering memory as the default source for GitHub-triggered automation."
}