{
  "date": "2026-08-05",
  "status": "green",
  "summary": "GitHub push event processed for jobfynder-admin/jobFynder-BE-nestJS on branch main.",
  "repositories": [
    "jobfynder-admin/jobFynder-BE-nestJS"
  ],
  "completed": [
    "Source: GitHub webhook",
    "Repository: jobfynder-admin/jobFynder-BE-nestJS",
    "Branch: main",
    "Head SHA: 207358b",
    "Commit count: 1",
    "Triggered by: atult120",
    "Commits:",
    "207358b Close profile API gaps: GET fidelity, write endpoints, and stop test-data stubs. \u2014 atultiwari",
    "Changed files:",
    "added: prisma/migrations/20260804120000_add_value_proposition_relocation/migration.sql",
    "added: src/prompts/education.prompt",
    "modified: prisma/schema.prisma",
    "modified: src/ai/ai.service.ts",
    "modified: src/common/utils/date-parser.util.ts",
    "modified: src/content-generation/content-generation.service.ts",
    "modified: src/content-generation/dto/generate-content.dto.ts",
    "modified: src/profile/common/master-data.service.ts",
    "modified: src/profile/consultant-sections/consultant-crud.controller.ts",
    "modified: src/profile/consultant-sections/consultant-crud.service.ts",
    "modified: src/profile/consultant-sections/consultant-sections.controller.ts",
    "modified: src/profile/consultant-sections/consultant-sections.service.ts",
    "modified: src/profile/consultant-sections/dto/crud.dto.ts",
    "modified: src/profile/consultant-sections/dto/sections.dto.ts",
    "modified: src/profile/employer-ops/dto/employer-ops.dto.ts",
    "modified: src/profile/employer-ops/employer-ops.service.ts",
    "modified: src/profile/header/dto/employer-header.dto.ts",
    "modified: src/profile/header/dto/recruiter-header.dto.ts",
    "modified: src/profile/header/header.service.ts",
    "modified: src/profile/profile-transformers.service.ts",
    "modified: src/profile/profile.module.ts",
    "modified: src/profile/profile.service.ts"
  ],
  "decisions": [
    {
      "id": "ADR-EMI-002",
      "title": "Engineering Memory accepts GitHub webhook input",
      "status": "accepted",
      "summary": "Hermes can generate engineering memory from GitHub webhook repository, branch, commit, author, and changed-file context."
    }
  ],
  "incidents": [],
  "lessons_learned": [
    "Repo-aware engineering memory is more useful than generic repository scanning.",
    "Webhook payloads provide reliable commit, author, branch, and changed-file context."
  ],
  "open_items": [
    "Improve event archive to store full webhook payload.",
    "Add failure alerting for memory automation.",
    "Add deduplication guard for repeated memory commits."
  ],
  "tomorrow_objective": "Use repo-aware engineering memory as the default source for GitHub-triggered automation."
}