{
  "date": "2026-09-12",
  "status": "green",
  "summary": "GitHub push event processed for jobfynder-admin/jobFynder-BE-nestJS on branch main.",
  "repositories": [
    "jobfynder-admin/jobFynder-BE-nestJS"
  ],
  "completed": [
    "Source: GitHub webhook",
    "Repository: jobfynder-admin/jobFynder-BE-nestJS",
    "Branch: main",
    "Head SHA: c06129f",
    "Commit count: 1",
    "Triggered by: atult120",
    "Commits:",
    "c06129f fix(profile): persist and update consultant skills strictly in user_skills \u2014 atultiwari",
    "Changed files:",
    "added: src/profile/consultant-sections/consultant-crud.service.spec.ts",
    "modified: src/profile/consultant-sections/consultant-crud.service.ts"
  ],
  "decisions": [
    {
      "id": "ADR-EMI-002",
      "title": "Engineering Memory accepts GitHub webhook input",
      "status": "accepted",
      "summary": "Hermes can generate engineering memory from GitHub webhook repository, branch, commit, author, and changed-file context."
    }
  ],
  "incidents": [],
  "lessons_learned": [
    "Repo-aware engineering memory is more useful than generic repository scanning.",
    "Webhook payloads provide reliable commit, author, branch, and changed-file context."
  ],
  "open_items": [
    "Improve event archive to store full webhook payload.",
    "Add failure alerting for memory automation.",
    "Add deduplication guard for repeated memory commits."
  ],
  "tomorrow_objective": "Use repo-aware engineering memory as the default source for GitHub-triggered automation."
}