{
  "date": "2026-08-10",
  "status": "green",
  "summary": "GitHub push event processed for jobfynder-admin/jobFynder-FE-vite on branch dev.",
  "repositories": [
    "jobfynder-admin/jobFynder-FE-vite"
  ],
  "completed": [
    "Source: GitHub webhook",
    "Repository: jobfynder-admin/jobFynder-FE-vite",
    "Branch: dev",
    "Head SHA: 9833cdb",
    "Commit count: 1",
    "Triggered by: jobfynder-admin",
    "Commits:",
    "9833cdb Integrate Messenger UI with Jobfynder core and realtime \u2014 Pavan",
    "Changed files:",
    "added: src/components/ErrorBoundary.jsx",
    "added: src/components/HeaderOverflowMenu.jsx",
    "added: src/components/messenger/BulkToolbar.jsx",
    "added: src/components/messenger/CategorySection.jsx",
    "added: src/components/messenger/ChatView.jsx",
    "added: src/components/messenger/CollapsibleSection.jsx",
    "added: src/components/messenger/ConnectionBanner.jsx",
    "added: src/components/messenger/ContextPanel.jsx",
    "added: src/components/messenger/ContextStrip.jsx",
    "added: src/components/messenger/ConversationRow.jsx",
    "added: src/components/messenger/ConversationRowSkeleton.jsx",
    "added: src/components/messenger/ConversationSidebar.jsx",
    "added: src/components/messenger/FilterChips.jsx",
    "added: src/components/messenger/FilterSheet.jsx",
    "added: src/components/messenger/MessageComposer.jsx",
    "added: src/components/messenger/NavLeaf.jsx",
    "added: src/components/messenger/NewConversationDialog.jsx",
    "added: src/components/messenger/TagPicker.jsx",
    "added: src/components/messenger/call/ActiveCallBar.jsx",
    "added: src/components/messenger/call/AudioCallButton.jsx",
    "added: src/components/messenger/call/AudioCallOverlay.jsx",
    "added: src/components/messenger/call/CallControls.jsx",
    "added: src/components/messenger/call/CallEndState.jsx",
    "added: src/components/messenger/call/CallQualityIndicator.jsx",
    "added: src/components/messenger/call/CallStage.jsx",
    "added: src/components/messenger/call/CallTopBar.jsx",
    "added: src/components/messenger/call/GroupCallOverlay.jsx",
    "added: src/components/messenger/call/GroupCallPicker.jsx",
    "added: src/components/messenger/call/IncomingCallModal.jsx",
    "added: src/components/messenger/call/IncomingVideoCallModal.jsx",
    "added: src/components/messenger/call/JobfynderCallControls.jsx",
    "added: src/components/messenger/call/JobfynderVideoRoom.jsx",
    "added: src/components/messenger/call/LocalVideoPreview.jsx",
    "added: src/components/messenger/call/MediaDeviceMenu.jsx",
    "added: src/components/messenger/call/OutgoingCallPanel.jsx",
    "added: src/components/messenger/call/ParticipantVideo.jsx",
    "added: src/components/messenger/call/ScreenShareStage.jsx",
    "added: src/components/messenger/call/SelfPiP.jsx",
    "added: src/components/messenger/call/SharedScreen.jsx",
    "added: src/components/messenger/call/VideoCall.jsx",
    "added: src/components/messenger/call/VideoCallButton.jsx",
    "added: src/components/messenger/composer/AttachmentTray.jsx",
    "added: src/components/messenger/composer/DragDropOverlay.jsx",
    "added: src/components/messenger/composer/ResumePicker.jsx",
    "added: src/components/messenger/composer/SharePicker.jsx",
    "added: src/components/messenger/composer/TemplatePicker.jsx",
    "added: src/components/messenger/composer/VoiceRecorder.jsx",
    "added: src/components/messenger/composer/useAttachments.js",
    "added: src/components/messenger/messages/AttachmentCard.jsx",
    "added: src/components/messenger/messages/DateSeparator.jsx",
    "added: src/components/messenger/messages/EmptyState.jsx",
    "added: src/components/messenger/messages/InterviewUpdate.jsx",
    "added: src/components/messenger/messages/JobCard.jsx",
    "added: src/components/messenger/messages/MessageActions.jsx",
    "added: src/components/messenger/messages/MessageItem.jsx",
    "added: src/components/messenger/messages/MessageList.jsx",
    "added: src/components/messenger/messages/MessageSkeleton.jsx",
    "added: src/components/messenger/messages/OfferUpdate.jsx",
    "added: src/components/messenger/messages/ResumeCard.jsx",
    "added: src/components/messenger/messages/SubmissionUpdate.jsx",
    "added: src/components/messenger/messages/SystemMessage.jsx",
    "added: src/components/messenger/messages/TypingIndicator.jsx",
    "added: src/components/messenger/messages/UnreadSeparator.jsx",
    "added: src/components/messenger/mobile/ActionSheet.jsx",
    "added: src/components/messenger/mobile/BottomTabs.jsx",
    "added: src/components/messenger/mobile/MobileChatView.jsx",
    "added: src/components/messenger/mobile/MobileContextSheet.jsx",
    "added: src/components/messenger/mobile/MobileHotlist.jsx",
    "added: src/components/messenger/mobile/MobileInbox.jsx",
    "added: src/components/messenger/mobile/MobileMessenger.jsx",
    "added: src/components/messenger/mobile/MobileProfile.jsx",
    "added: src/components/messenger/mobile/MobileSearch.jsx",
    "added: src/components/messenger/mobile/MobileSubmissions.jsx",
    "added: src/components/messenger/mobile/SwipeRow.jsx",
    "added: src/components/messenger/panel/CalendarInviteModal.jsx",
    "added: src/components/messenger/panel/CandidatePipeline.jsx",
    "added: src/components/messenger/panel/CandidateSection.jsx",
    "added: src/components/messenger/panel/CompanySection.jsx",
    "added: src/components/messenger/panel/ContextAction.jsx",
    "added: src/components/messenger/panel/ContextField.jsx",
    "added: src/components/messenger/panel/ConversationSettingsSection.jsx",
    "added: src/components/messenger/panel/Introduction.jsx",
    "added: src/components/messenger/panel/IntroductionSection.jsx",
    "added: src/components/messenger/panel/JobSection.jsx",
    "added: src/components/messenger/panel/NextAction.jsx",
    "added: src/components/messenger/panel/ParticipantsSection.jsx",
    "added: src/components/messenger/panel/PrivacyState.jsx",
    "added: src/components/messenger/panel/QuickActions.jsx",
    "added: src/components/messenger/panel/SharedFiles.jsx",
    "added: src/components/messenger/panel/StageSelector.jsx",
    "added: src/components/messenger/panel/SubmissionSection.jsx",
    "added: src/components/messenger/panel/Timeline.jsx",
    "added: src/components/messenger/panel/TimelineSection.jsx",
    "added: src/components/messenger/panel/UpcomingInterview.jsx",
    "added: src/components/messenger/profile/AppearanceDialog.jsx",
    "added: src/components/messenger/profile/HelpFeedbackDialog.jsx",
    "added: src/components/messenger/profile/KeyboardShortcutsDialog.jsx",
    "added: src/components/messenger/profile/NotificationsDialog.jsx",
    "added: src/components/messenger/profile/SettingsDialog.jsx",
    "added: src/components/messenger/shell/ConversationContextRegion.jsx",
    "added: src/components/messenger/shell/ConversationListRegion.jsx",
    "added: src/components/messenger/shell/ConversationWorkspaceRegion.jsx",
    "added: src/components/messenger/shell/MessengerConnectionStatus.jsx",
    "added: src/components/messenger/shell/MessengerDesktopLayout.jsx",
    "added: src/components/messenger/shell/MessengerEmptyWorkspace.jsx",
    "added: src/components/messenger/shell/MessengerHeader.jsx",
    "added: src/components/messenger/shell/MessengerMobileLayout.jsx",
    "added: src/components/messenger/shell/MessengerPlaceholder.jsx",
    "added: src/components/messenger/shell/MessengerShell.jsx",
    "added: src/components/messenger/shell/SidebarRail.jsx",
    "added: src/components/ui/image.jsx",
    "added: src/components/ui/switch.jsx",
    "added: src/hooks/use-mobile.jsx",
    "added: src/hooks/use-size.jsx",
    "added: src/hooks/useThread.js",
    "added: src/lib/attachmentApi.js",
    "added: src/lib/attachmentConfig.js",
    "added: src/lib/callConfig.js",
    "added: src/lib/callConfig.test.js",
    "added: src/lib/callStateMachine.js",
    "added: src/lib/callStateMachine.test.js",
    "added: src/lib/contextCapabilities.js",
    "added: src/lib/contextFocusStore.js",
    "added: src/lib/drafts.js",
    "added: src/lib/drafts.test.js",
    "added: src/lib/featureFlags.js",
    "added: src/lib/messengerApi.mock-helpers.ts",
    "added: src/lib/messengerApi.ts",
    "added: src/lib/messengerCapabilities.js",
    "added: src/lib/messengerData.js",
    "added: src/lib/messengerFilters.js",
    "added: src/lib/messengerRoles.js",
    "added: src/lib/mobileNav.js",
    "added: src/lib/mobileNav.test.js",
    "added: src/lib/observability.js",
    "added: src/lib/pinStore.js",
    "added: src/lib/realtime.js",
    "added: src/lib/recruiterContent.js",
    "added: src/lib/roleContext.js",
    "added: src/lib/screenShareStateMachine.js",
    "added: src/lib/screenShareStateMachine.test.js",
    "added: src/lib/settingsStore.js",
    "added: src/lib/submissionStatusStore.js",
    "added: src/lib/utils.js",
    "modified: package-lock.json",
    "modified: package.json",
    "modified: src/features/messenger/MessengerPage.tsx"
  ],
  "decisions": [
    {
      "id": "ADR-EMI-002",
      "title": "Engineering Memory accepts GitHub webhook input",
      "status": "accepted",
      "summary": "Hermes can generate engineering memory from GitHub webhook repository, branch, commit, author, and changed-file context."
    }
  ],
  "incidents": [],
  "lessons_learned": [
    "Repo-aware engineering memory is more useful than generic repository scanning.",
    "Webhook payloads provide reliable commit, author, branch, and changed-file context."
  ],
  "open_items": [
    "Improve event archive to store full webhook payload.",
    "Add failure alerting for memory automation.",
    "Add deduplication guard for repeated memory commits."
  ],
  "tomorrow_objective": "Use repo-aware engineering memory as the default source for GitHub-triggered automation."
}