{
  "date": "2026-09-25",
  "status": "green",
  "summary": "GitHub push event processed for jobfynder-admin/jobFynder-FE-vite on branch feat/network-workspace.",
  "repositories": [
    "jobfynder-admin/jobFynder-FE-vite"
  ],
  "completed": [
    "Source: GitHub webhook",
    "Repository: jobfynder-admin/jobFynder-FE-vite",
    "Branch: feat/network-workspace",
    "Head SHA: e601d26",
    "Commit count: 1",
    "Triggered by: jobfynder-admin",
    "Commits:",
    "e601d26 fix(network): correct follow-up due label for future dates and pluralise counts \u2014 Jobfynder",
    "Changed files:",
    "modified: src/pages/private/NetworkWorkspace.tsx"
  ],
  "decisions": [
    {
      "id": "ADR-EMI-002",
      "title": "Engineering Memory accepts GitHub webhook input",
      "status": "accepted",
      "summary": "Hermes can generate engineering memory from GitHub webhook repository, branch, commit, author, and changed-file context."
    }
  ],
  "incidents": [],
  "lessons_learned": [
    "Repo-aware engineering memory is more useful than generic repository scanning.",
    "Webhook payloads provide reliable commit, author, branch, and changed-file context."
  ],
  "open_items": [
    "Improve event archive to store full webhook payload.",
    "Add failure alerting for memory automation.",
    "Add deduplication guard for repeated memory commits."
  ],
  "tomorrow_objective": "Use repo-aware engineering memory as the default source for GitHub-triggered automation."
}