{
  "date": "2026-09-07",
  "status": "green",
  "summary": "GitHub push event processed for jobfynder-admin/jobFynder-BE-nestJS on branch main.",
  "repositories": [
    "jobfynder-admin/jobFynder-BE-nestJS"
  ],
  "completed": [
    "Source: GitHub webhook",
    "Repository: jobfynder-admin/jobFynder-BE-nestJS",
    "Branch: main",
    "Head SHA: a756a7e",
    "Commit count: 1",
    "Triggered by: atult120",
    "Commits:",
    "a756a7e chore: ignore Graphify output and sync Cursor plans and specs \u2014 atultiwari",
    "Changed files:",
    "added: .cursor/agents/code-reviewer.md",
    "added: .cursor/plans/import_profile_field_mapping_b8d848f7.plan.md",
    "added: .cursor/plans/onboarding_redesign_backend_34b5010f.plan.md",
    "added: .cursor/rules/graphify.mdc",
    "added: .graphifyignore",
    "added: jobfynder-relationship-engine-and-search.md",
    "added: onboarding-redesign-backend-spec.md",
    "modified: .gitignore",
    "removed: .cursor/plans/fetch_all_hiring_companies_e6763e0e.plan.md",
    "removed: .cursor/plans/hermes_core_integration_65d4c002.plan.md",
    "removed: .cursor/plans/hiring_companies_db_mapping_7e6b320b.plan.md",
    "removed: .cursor/plans/linkedin_scrape_import_78ad7905.plan.md",
    "removed: .cursor/plans/profile_api_gaps_a9a15d04.plan.md",
    "removed: .cursor/plans/profile_granular_apis_5fba32ad.plan.md",
    "removed: .cursor/plans/profile_missing_data_d9c581a7.plan.md"
  ],
  "decisions": [
    {
      "id": "ADR-EMI-002",
      "title": "Engineering Memory accepts GitHub webhook input",
      "status": "accepted",
      "summary": "Hermes can generate engineering memory from GitHub webhook repository, branch, commit, author, and changed-file context."
    }
  ],
  "incidents": [],
  "lessons_learned": [
    "Repo-aware engineering memory is more useful than generic repository scanning.",
    "Webhook payloads provide reliable commit, author, branch, and changed-file context."
  ],
  "open_items": [
    "Improve event archive to store full webhook payload.",
    "Add failure alerting for memory automation.",
    "Add deduplication guard for repeated memory commits."
  ],
  "tomorrow_objective": "Use repo-aware engineering memory as the default source for GitHub-triggered automation."
}