{
  "date": "2026-09-27",
  "status": "green",
  "summary": "GitHub push event processed for jobfynder/hermes on branch feat/reviewed-skill-enrichment.",
  "repositories": [
    "jobfynder/hermes"
  ],
  "completed": [
    "Source: GitHub webhook",
    "Repository: jobfynder/hermes",
    "Branch: feat/reviewed-skill-enrichment",
    "Head SHA: 1212db8",
    "Commit count: 1",
    "Triggered by: jobfynder",
    "Commits:",
    "1212db8 feat: add reviewed skill enrichment proposals \u2014 OpenAI Codex",
    "Changed files:",
    "added: docs/skill-enrichment-review-workflow.md",
    "modified: app/prompt_runtime/registry.json",
    "modified: app/routers/moderation.py",
    "modified: app/runtime/db.py",
    "modified: app/skill_intelligence/models.py",
    "modified: app/skill_intelligence/suggestions.py",
    "modified: app/understanding/taxonomy/loader.py",
    "modified: app/understanding/taxonomy/models.py",
    "modified: tests/test_skill_suggestions.py"
  ],
  "decisions": [
    {
      "id": "ADR-EMI-002",
      "title": "Engineering Memory accepts GitHub webhook input",
      "status": "accepted",
      "summary": "Hermes can generate engineering memory from GitHub webhook repository, branch, commit, author, and changed-file context."
    }
  ],
  "incidents": [],
  "lessons_learned": [
    "Repo-aware engineering memory is more useful than generic repository scanning.",
    "Webhook payloads provide reliable commit, author, branch, and changed-file context."
  ],
  "open_items": [
    "Improve event archive to store full webhook payload.",
    "Add failure alerting for memory automation.",
    "Add deduplication guard for repeated memory commits."
  ],
  "tomorrow_objective": "Use repo-aware engineering memory as the default source for GitHub-triggered automation."
}