{
  "date": "2026-09-11",
  "status": "green",
  "summary": "GitHub push event processed for jobfynder/hermes on branch main.",
  "repositories": [
    "jobfynder/hermes"
  ],
  "completed": [
    "Source: GitHub webhook",
    "Repository: jobfynder/hermes",
    "Branch: main",
    "Head SHA: b63bdd7",
    "Commit count: 1",
    "Triggered by: jobfynder",
    "Commits:",
    "b63bdd7 Recover spaced relay companies and prevent taxonomy noise promotion \u2014 Jobfynder Automation",
    "Changed files:",
    "added: app/understanding/taxonomy/skill_quality.py",
    "added: tests/test_relay_spacing.py",
    "added: tests/test_skill_quality.py",
    "modified: .github/workflows/hermes-regression.yml",
    "modified: app/email_parsing/signature.py",
    "modified: app/understanding/parsers/skills.py",
    "modified: app/understanding/service.py",
    "modified: app/understanding/taxonomy/candidates.py",
    "modified: app/understanding/taxonomy/loader.py",
    "modified: scripts/hermes-900-daily-taxonomy-triage.py"
  ],
  "decisions": [
    {
      "id": "ADR-EMI-002",
      "title": "Engineering Memory accepts GitHub webhook input",
      "status": "accepted",
      "summary": "Hermes can generate engineering memory from GitHub webhook repository, branch, commit, author, and changed-file context."
    }
  ],
  "incidents": [],
  "lessons_learned": [
    "Repo-aware engineering memory is more useful than generic repository scanning.",
    "Webhook payloads provide reliable commit, author, branch, and changed-file context."
  ],
  "open_items": [
    "Improve event archive to store full webhook payload.",
    "Add failure alerting for memory automation.",
    "Add deduplication guard for repeated memory commits."
  ],
  "tomorrow_objective": "Use repo-aware engineering memory as the default source for GitHub-triggered automation."
}